{
  "slug": "balena-os",
  "name": "Balena OS",
  "type": "sw.os",
  "version": "2",
  "data": { "libc": "glibc" },
  "requires": [
    {
      "or": [
        { "type": "arch.sw", "slug": "armv7hf" },
        { "type": "arch.sw", "slug": "rpi" },
        { "type": "arch.sw", "slug": "aarch64" },
        { "type": "arch.sw", "slug": "i386" },
        { "type": "arch.sw", "slug": "amd64" }
      ]
    }
  ]
}
